[
  {"id":"ckb:country:united_states","entity_type":"country","identity":{"canonical_name_en":"United States","canonical_name_zh":"美国","aliases":["USA","United States of America"]},"classification":{"domain":"Context","class":"Country","subclass":"State","eras":["WWII","EARLY_COLD_WAR","LATE_COLD_WAR","CONTEMPORARY"],"tags":["north_america","state"]},"relationships":[],"technical":{},"experience_profile":null,"gameplay":{"status":"draft"},"provenance":{"review_status":"source_checked","sources":[{"source_id":"us_state_department","url":"https://www.state.gov/countries-areas/united-states/"}]},"rights":{"rights_status":"deferred"}},
  {"id":"ckb:organization:manufacturer:chrysler_defense","entity_type":"organization","identity":{"canonical_name_en":"Chrysler Defense","canonical_name_zh":"克莱斯勒防务","aliases":["Chrysler Corporation Defense Division"]},"classification":{"domain":"Context","class":"Manufacturer","subclass":"DefenseManufacturer","eras":["EARLY_COLD_WAR","LATE_COLD_WAR"],"tags":["manufacturer","united_states","armored_vehicles"]},"relationships":[],"technical":{},"experience_profile":null,"gameplay":{"status":"draft"},"provenance":{"review_status":"source_checked","sources":[{"source_id":"us_army","url":"https://history.army.mil/books/Lineage/M1Abrams.pdf"}]},"rights":{"rights_status":"deferred"}},
  {"id":"ckb:unit:military:us_1st_infantry_division","entity_type":"unit","identity":{"canonical_name_en":"1st Infantry Division","canonical_name_zh":"美国陆军第一步兵师","aliases":["Big Red One","1ID"]},"classification":{"domain":"Context","class":"MilitaryUnit","subclass":"InfantryDivision","eras":["WWI","WWII","EARLY_COLD_WAR","CONTEMPORARY"],"tags":["united_states","infantry","division"]},"relationships":[],"technical":{},"experience_profile":null,"gameplay":{"status":"draft"},"provenance":{"review_status":"source_checked","sources":[{"source_id":"us_army_1id","url":"https://www.1id.army.mil/About-Us/Mission-History/"}]},"rights":{"rights_status":"deferred"}},
  {"id":"ckb:conflict:world_war_ii","entity_type":"conflict","identity":{"canonical_name_en":"World War II","canonical_name_zh":"第二次世界大战","aliases":["WWII","World War Two"]},"classification":{"domain":"Context","class":"Conflict","subclass":"WorldWar","eras":["WWII"],"tags":["global_conflict","1939_1945"]},"relationships":[],"technical":{},"experience_profile":null,"gameplay":{"status":"draft"},"provenance":{"review_status":"source_checked","sources":[{"source_id":"encyclopaedia_britannica","url":"https://www.britannica.com/event/World-War-II"}]},"rights":{"rights_status":"deferred"}},
  {"id":"ckb:person:designer:joseph_gavin","entity_type":"person","identity":{"canonical_name_en":"Joseph F. Gavin","canonical_name_zh":"约瑟夫·加文","aliases":["Joseph Gavin"]},"classification":{"domain":"Context","class":"Person","subclass":"MilitaryEngineer","eras":["EARLY_COLD_WAR"],"tags":["united_states","engineer","armored_vehicles"]},"relationships":[],"technical":{},"experience_profile":null,"gameplay":{"status":"draft"},"provenance":{"review_status":"source_checked","sources":[{"source_id":"us_army","url":"https://history.army.mil/books/Lineage/M1Abrams.pdf"}]},"rights":{"rights_status":"deferred"}},
  {"id":"ckb:facility:arsenal:detroit_arsenal","entity_type":"facility","identity":{"canonical_name_en":"Detroit Arsenal","canonical_name_zh":"底特律兵工厂","aliases":["Detroit Arsenal Tank Plant"]},"classification":{"domain":"Context","class":"Facility","subclass":"Arsenal","eras":["WWII","EARLY_COLD_WAR","LATE_COLD_WAR"],"tags":["united_states","manufacturing","armored_vehicles"]},"location":{"latitude":42.5167,"longitude":-83.0297,"precision":"city"},"relationships":[],"technical":{},"experience_profile":null,"gameplay":{"status":"draft"},"provenance":{"review_status":"source_checked","sources":[{"source_id":"us_army","url":"https://history.army.mil/books/Lineage/M1Abrams.pdf"}]},"rights":{"rights_status":"deferred"}},
  {"id":"ckb:place:facility:detroit","entity_type":"place","identity":{"canonical_name_en":"Detroit","canonical_name_zh":"底特律","aliases":[]},"classification":{"domain":"Context","class":"Place","subclass":"City","eras":["WWII","EARLY_COLD_WAR","LATE_COLD_WAR","CONTEMPORARY"],"tags":["united_states","michigan"]},"location":{"latitude":42.3314,"longitude":-83.0458,"precision":"city"},"relationships":[],"technical":{},"experience_profile":null,"gameplay":{"status":"draft"},"provenance":{"review_status":"source_checked","sources":[{"source_id":"usgs","url":"https://www.usgs.gov/centers/eros/science/geographic-names-information-system-gnis"}]},"rights":{"rights_status":"deferred"}}
]
