{"id":"ckb:weapon:firearm:m1_garand","entity_type":"weapon","identity":{"canonical_name_en":"M1 Garand","canonical_name_zh":"M1加兰德步枪","aliases":[]},"classification":{"domain":"Weapon","class":"Firearm","subclass":"Rifle","eras":["WWII"],"tags":["semi_automatic","infantry"]},"technical":{},"relationships":[],"experience_profile":null,"gameplay":{"status":"draft"},"provenance":{"review_status":"unverified","sources":[]},"rights":{"rights_status":"deferred"}}
