[
  {"id":"ckb:platform:ground:type_97_chi_ha","entity_type":"platform","identity":{"canonical_name_en":"Type 97 Chi-Ha","canonical_name_zh":"九七式中战车","aliases":["Chi-Ha medium tank"]},"classification":{"domain":"Platform","class":"GroundVehicle","subclass":"MediumTank","eras":["WWII"],"tags":["japanese","tracked","medium_tank","imperial_japanese_army"]},"relationships":[],"technical":{},"experience_profile":null,"gameplay":{"status":"draft"},"provenance":{"review_status":"source_checked","sources":[{"source_id":"wikipedia","url":"https://en.wikipedia.org/wiki/Type_97_Chi-Ha_medium_tank"},{"source_id":"official_military","url":"https://www.mod.go.jp/gsdf/nae/7d/siryoukan.html"}]},"rights":{"rights_status":"deferred"}},
  {"id":"ckb:platform:ground:type_61_tank","entity_type":"platform","identity":{"canonical_name_en":"Type 61 tank","canonical_name_zh":"61式主战坦克","aliases":["61式戦車"]},"classification":{"domain":"Platform","class":"GroundVehicle","subclass":"MainBattleTank","eras":["EARLY_COLD_WAR","LATE_COLD_WAR"],"tags":["japanese","tracked","main_battle_tank","postwar"]},"relationships":[],"technical":{},"experience_profile":null,"gameplay":{"status":"draft"},"provenance":{"review_status":"source_checked","sources":[{"source_id":"wikipedia","url":"https://en.wikipedia.org/wiki/Type_61_(tank)"},{"source_id":"official_military","url":"https://www.mod.go.jp/gsdf/nae/7d/siryoukan.html"}]},"rights":{"rights_status":"deferred"}},
  {"id":"ckb:platform:ground:type_74_tank","entity_type":"platform","identity":{"canonical_name_en":"Type 74 tank","canonical_name_zh":"74式主战坦克","aliases":["74式戦車"]},"classification":{"domain":"Platform","class":"GroundVehicle","subclass":"MainBattleTank","eras":["LATE_COLD_WAR"],"tags":["japanese","tracked","main_battle_tank","hydropneumatic_suspension"]},"relationships":[],"technical":{},"experience_profile":null,"gameplay":{"status":"draft"},"provenance":{"review_status":"source_checked","sources":[{"source_id":"wikipedia","url":"https://en.wikipedia.org/wiki/Type_74"},{"source_id":"official_military","url":"https://www.mod.go.jp/gsdf/nae/2d/kuniwomamoru/soubihin/souki/74tk.htm"}]},"rights":{"rights_status":"deferred"}},
  {"id":"ckb:platform:ground:type_90_tank","entity_type":"platform","identity":{"canonical_name_en":"Type 90 tank","canonical_name_zh":"90式主战坦克","aliases":["90式戦車"]},"classification":{"domain":"Platform","class":"GroundVehicle","subclass":"MainBattleTank","eras":["LATE_COLD_WAR","CONTEMPORARY"],"tags":["japanese","tracked","main_battle_tank","autoloader"]},"relationships":[],"technical":{},"experience_profile":null,"gameplay":{"status":"draft"},"provenance":{"review_status":"source_checked","sources":[{"source_id":"wikipedia","url":"https://en.wikipedia.org/wiki/Type_90_tank"},{"source_id":"official_military","url":"https://www.mod.go.jp/gsdf/nae/2d/kuniwomamoru/soubihin/souki/90tk.htm"}]},"rights":{"rights_status":"deferred"}},
  {"id":"ckb:platform:ground:type_10_tank","entity_type":"platform","identity":{"canonical_name_en":"Type 10 tank","canonical_name_zh":"10式主战坦克","aliases":["10式戦車"]},"classification":{"domain":"Platform","class":"GroundVehicle","subclass":"MainBattleTank","eras":["CONTEMPORARY"],"tags":["japanese","tracked","main_battle_tank","modular_armor"]},"relationships":[],"technical":{},"experience_profile":null,"gameplay":{"status":"draft"},"provenance":{"review_status":"source_checked","sources":[{"source_id":"wikipedia","url":"https://en.wikipedia.org/wiki/Type_10_tank"},{"source_id":"official_military","url":"https://www.mod.go.jp/atla/saiyou/gallery/sobihin.html"}]},"rights":{"rights_status":"deferred"}}
]
