{"id":"ckb:weapon:melee:longsword","entity_type":"weapon","identity":{"canonical_name_en":"Longsword","canonical_name_zh":"长剑","aliases":[]},"classification":{"domain":"Weapon","class":"MeleeWeapon","subclass":"Blade","eras":["MEDIEVAL"],"tags":["cutting","thrusting"]},"technical":{},"relationships":[],"experience_profile":null,"gameplay":{"status":"draft"},"provenance":{"review_status":"unverified","sources":[]},"rights":{"rights_status":"deferred"}}
