[{"id":"ckb:platform:ground:type_59_tank","entity_type":"platform","identity":{"canonical_name_en":"Type 59 tank","canonical_name_zh":"59式中型坦克","aliases":["WZ-120"]},"classification":{"domain":"Platform","class":"GroundVehicle","subclass":"MediumTank","eras":["EARLY_COLD_WAR","LATE_COLD_WAR","CONTEMPORARY"],"tags":["chinese","tracked","medium_tank","t_54_derivative"]},"relationships":[],"technical":{},"experience_profile":null,"gameplay":{"status":"draft"},"provenance":{"review_status":"unverified","sources":[{"source_id":"wikipedia","url":"https://en.wikipedia.org/wiki/Type_59_tank"}]},"rights":{"rights_status":"deferred"}},{"id":"ckb:platform:ground:type_69_tank","entity_type":"platform","identity":{"canonical_name_en":"Type 69 tank","canonical_name_zh":"69式中型坦克","aliases":["WZ-121"]},"classification":{"domain":"Platform","class":"GroundVehicle","subclass":"MediumTank","eras":["LATE_COLD_WAR","CONTEMPORARY"],"tags":["chinese","tracked","medium_tank","exported"]},"relationships":[],"technical":{},"experience_profile":null,"gameplay":{"status":"draft"},"provenance":{"review_status":"unverified","sources":[{"source_id":"wikipedia","url":"https://en.wikipedia.org/wiki/Type_69_tank"}]},"rights":{"rights_status":"deferred"}},{"id":"ckb:platform:ground:type_80_tank","entity_type":"platform","identity":{"canonical_name_en":"Type 80 tank","canonical_name_zh":"80式主战坦克","aliases":["Type 80/88"]},"classification":{"domain":"Platform","class":"GroundVehicle","subclass":"MainBattleTank","eras":["LATE_COLD_WAR"],"tags":["chinese","tracked","main_battle_tank","second_generation"]},"relationships":[],"technical":{},"experience_profile":null,"gameplay":{"status":"draft"},"provenance":{"review_status":"unverified","sources":[{"source_id":"wikipedia","url":"https://en.wikipedia.org/wiki/Type_80_tank"}]},"rights":{"rights_status":"deferred"}},{"id":"ckb:platform:ground:type_96_tank","entity_type":"platform","identity":{"canonical_name_en":"Type 96 tank","canonical_name_zh":"96式主战坦克","aliases":["ZTZ-96"]},"classification":{"domain":"Platform","class":"GroundVehicle","subclass":"MainBattleTank","eras":["CONTEMPORARY"],"tags":["chinese","tracked","main_battle_tank","third_generation"]},"relationships":[],"technical":{},"experience_profile":null,"gameplay":{"status":"draft"},"provenance":{"review_status":"unverified","sources":[{"source_id":"wikipedia","url":"https://en.wikipedia.org/wiki/Type_96_tank"}]},"rights":{"rights_status":"deferred"}},{"id":"ckb:platform:ground:type_99_tank","entity_type":"platform","identity":{"canonical_name_en":"Type 99 tank","canonical_name_zh":"99式主战坦克","aliases":["ZTZ-99"]},"classification":{"domain":"Platform","class":"GroundVehicle","subclass":"MainBattleTank","eras":["CONTEMPORARY"],"tags":["chinese","tracked","main_battle_tank","third_generation"]},"relationships":[],"technical":{},"experience_profile":null,"gameplay":{"status":"draft"},"provenance":{"review_status":"unverified","sources":[{"source_id":"wikipedia","url":"https://en.wikipedia.org/wiki/Type_99_tank"}]},"rights":{"rights_status":"deferred"}}]
