{"id":"ckb:platform:air:f_16c","entity_type":"platform","identity":{"canonical_name_en":"F-16C Fighting Falcon","canonical_name_zh":"F-16C战斗机","aliases":[]},"classification":{"domain":"Platform","class":"Aircraft","subclass":"Fighter","eras":["LATE_COLD_WAR","POST_COLD_WAR","CONTEMPORARY"],"tags":["multirole","jet","fly_by_wire"]},"technical":{},"relationships":[],"experience_profile":null,"gameplay":{"status":"draft"},"provenance":{"review_status":"unverified","sources":[]},"rights":{"rights_status":"deferred"}}
