{"id":"ckb:weapon:early_gunpowder:matchlock_musket","entity_type":"weapon","identity":{"canonical_name_en":"Matchlock musket","canonical_name_zh":"火绳枪","aliases":[]},"classification":{"domain":"Weapon","class":"EarlyGunpowderWeapon","subclass":"Matchlock","eras":["EARLY_MODERN"],"tags":["black_powder","muzzle_loading"]},"technical":{},"relationships":[],"experience_profile":null,"gameplay":{"status":"draft"},"provenance":{"review_status":"unverified","sources":[]},"rights":{"rights_status":"deferred"}}
