{"id":"ckb:platform:ground:t_34_85","entity_type":"platform","identity":{"canonical_name_en":"T-34-85","canonical_name_zh":"T-34-85中型坦克","aliases":[]},"classification":{"domain":"Platform","class":"GroundVehicle","subclass":"Tank","eras":["WWII"],"tags":["soviet","tracked","turreted","armored","medium_tank"]},"technical":{},"relationships":[],"experience_profile":null,"gameplay":{"status":"draft"},"provenance":{"review_status":"unverified","sources":[{"source_id":"wikipedia","url":"https://en.wikipedia.org/wiki/T-34"}]},"rights":{"rights_status":"deferred"}}
