[
  {
    "id": "ckb:platform:ground:char_b1_bis",
    "entity_type": "platform",
    "identity": {
      "canonical_name_en": "Char B1 bis",
      "canonical_name_zh": "B1 bis重型坦克",
      "aliases": ["B1 bis"]
    },
    "classification": {
      "domain": "Platform",
      "class": "GroundVehicle",
      "subclass": "HeavyTank",
      "eras": ["INTERWAR", "WWII"],
      "tags": ["french", "tracked", "heavy_tank", "infantry_support"]
    },
    "relationships": [],
    "technical": {},
    "experience_profile": null,
    "gameplay": {"status": "draft"},
    "provenance": {
      "review_status": "source_checked",
      "sources": [
        {"source_id": "wikipedia", "url": "https://en.wikipedia.org/wiki/Char_B1"},
        {"source_id": "tank_museum", "url": "https://museedesblindes.fr/les_chars/b1-bis/"}
      ]
    },
    "rights": {"rights_status": "deferred"}
  },
  {
    "id": "ckb:platform:ground:amx_13",
    "entity_type": "platform",
    "identity": {
      "canonical_name_en": "AMX-13",
      "canonical_name_zh": "AMX-13轻型坦克",
      "aliases": ["AMX-13 light tank"]
    },
    "classification": {
      "domain": "Platform",
      "class": "GroundVehicle",
      "subclass": "LightTank",
      "eras": ["EARLY_COLD_WAR", "LATE_COLD_WAR"],
      "tags": ["french", "tracked", "light_tank", "oscillating_turret"]
    },
    "relationships": [],
    "technical": {},
    "experience_profile": null,
    "gameplay": {"status": "draft"},
    "provenance": {
      "review_status": "source_checked",
      "sources": [
        {"source_id": "wikipedia", "url": "https://en.wikipedia.org/wiki/AMX-13"},
        {"source_id": "tank_museum", "url": "https://museedesblindes.fr/depuis-1990/"}
      ]
    },
    "rights": {"rights_status": "deferred"}
  },
  {
    "id": "ckb:platform:ground:amx_30",
    "entity_type": "platform",
    "identity": {
      "canonical_name_en": "AMX-30",
      "canonical_name_zh": "AMX-30主战坦克",
      "aliases": ["AMX-30B"]
    },
    "classification": {
      "domain": "Platform",
      "class": "GroundVehicle",
      "subclass": "MainBattleTank",
      "eras": ["LATE_COLD_WAR"],
      "tags": ["french", "tracked", "main_battle_tank", "mobility_focused"]
    },
    "relationships": [],
    "technical": {},
    "experience_profile": null,
    "gameplay": {"status": "draft"},
    "provenance": {
      "review_status": "source_checked",
      "sources": [
        {"source_id": "wikipedia", "url": "https://en.wikipedia.org/wiki/AMX-30"},
        {"source_id": "tank_museum", "url": "https://museedesblindes.fr/les_chars/lamx-30b2/"}
      ]
    },
    "rights": {"rights_status": "deferred"}
  },
  {
    "id": "ckb:platform:ground:leclerc_tank",
    "entity_type": "platform",
    "identity": {
      "canonical_name_en": "Leclerc tank",
      "canonical_name_zh": "勒克莱尔主战坦克",
      "aliases": ["AMX-56 Leclerc"]
    },
    "classification": {
      "domain": "Platform",
      "class": "GroundVehicle",
      "subclass": "MainBattleTank",
      "eras": ["CONTEMPORARY"],
      "tags": ["french", "tracked", "main_battle_tank", "autoloader"]
    },
    "relationships": [],
    "technical": {},
    "experience_profile": null,
    "gameplay": {"status": "draft"},
    "provenance": {
      "review_status": "source_checked",
      "sources": [
        {"source_id": "wikipedia", "url": "https://en.wikipedia.org/wiki/Leclerc_tank"},
        {"source_id": "official_military", "url": "https://www.defense.gouv.fr/terre/nos-materiels/nos-equipements-terre/vehicules-larmee-terre/vehicules-chars-bataille/char-leclerc"}
      ]
    },
    "rights": {"rights_status": "deferred"}
  }
]
